Content,NB_Emotion_Predicted,SVM_Emotion_Predicted,KNN_Emotion_Predicted,Emotion_Actual
Police manufacture murder Wonder why carry burners MaxLevelz shake,fear,fear,fear,fear
dish_answers contact dish service whathappenedtocustomerservice,fear,fear,fear,fear
Geminiak you welcome wordgeek nAlso good put face the twitter fee even only cheery hello,joy,joy,fear,joy
wouldn cross the street piss its server dire,fear,fear,fear,fear
know when you just slightly high the state between sober and high That beautiful wish could feel like that,sadness,sadness,sadness,sadness
still terribledebatequestions,fear,fear,joy,joy
Doesn matter whn you start something long you start today Age only exist the mind You Timeless,fear,fear,fear,fear
furious,fear,anger,anger,anger
2008 crisis just the tremor advance the earthquake,fear,fear,fear,fear
this hilarious,joy,joy,joy,joy
Seriously sick and grumpy and the only thing that gon cheer order xmas food when,joy,joy,joy,joy
cant stop finish deject luckily one the bathroom stall and wait until pant dry,fear,sadness,sadness,sadness
have try cheerful upbeat piece Walking through History usually arty docu type Can not find trace,fear,joy,fear,joy
even when fight laugh probably have serious ingrain issuesðŸ,sadness,sadness,sadness,sadness
hour rid make angry sorry,anger,anger,anger,anger
end how meet your mother dreadful,fear,fear,fear,sadness
little frustrate much misplace something Been look for key for hours now,anger,anger,anger,anger
That why compatibility key lower hedonic volatility,fear,fear,fear,joy
soywax limit edition horror candle Follow for all the latest news,fear,fear,fear,fear
thank gen Love you miss you happy birthday natong duha,joy,joy,joy,joy
just find out Candice and not Candace She can pout all she like for,sadness,sadness,sadness,sadness
boys dint know the game the game life after death better choose and know who side you before wrath come upon usðŸ,joy,joy,anger,anger
much sadness and heartbreak,sadness,sadness,sadness,sadness
hollywooddivas Idiots like Larry Sanders scare All How can Morons these days Rush Judge Police all facts yet thugs,fear,fear,sadness,fear
feel this precious pleasure Harder whisper almost breathless and his index finger stroke along his waistband,joy,joy,fear,fear
don get that parent literally don see how unhappy lately,sadness,sadness,sadness,sadness
WAN GET AND DANCE but everyone bed this suck Everyone wake hyper letsdance dirtydancinginthemoonlightðŸ,joy,joy,fear,joy
wouldn that basically sparkle water,joy,joy,joy,joy
home depress,sadness,sadness,sadness,sadness
can you least just walk past her and break out into laughter,joy,joy,fear,joy
Doesnt anyone else literally pull into the office cause someone complain spit the sink yesterday,sadness,sadness,sadness,sadness
You get tremendous range,fear,fear,fear,fear
OutlanderHome not film smile please,joy,joy,fear,joy
grim really,sadness,sadness,sadness,sadness
tmobile store original note7 customer and zero result What guy customerservice 2hour waittime,fear,fear,fear,fear
well ladies great award for amaze team delight present the award you,joy,joy,sadness,joy
why the ticket website never work Trying buy Palace ticket and impossible and say there error awful,fear,fear,fear,fear
outrage over Kessel tweet butthurt USA players hilarious,anger,anger,anger,anger
stay Dubai,sadness,sadness,sadness,sadness
nearly drop phone into the sink HAHAHAHA,fear,sadness,sadness,sadness
GunnySmith93 Stephen21Smith nDays like today happy alive bless,joy,joy,joy,joy
right reply UNGA Pakistan preach human right country which itself the global epicentre,fear,fear,fear,fear
Magrove86Mark jersey gloves dark,sadness,sadness,fear,sadness
guy now lessons via Skype Contact for more info skype lesson basslessons teacher free lesson music groove rock blue,sadness,sadness,sadness,sadness
Thank you much Just home stun but happy Don think have sink yet Wow,sadness,sadness,sadness,sadness
donlemon listen these politicians make angry fuck tire political speak career politicians,anger,anger,sadness,anger
immense importance football sometimes scary When you donâ win you responsible for many unhappy people Arsene Wenger,sadness,sadness,sadness,sadness
PixelMonsterYT TeamGE0 IZEDEPTIC ztumtum CrimtideTV LtGrandslam Bahahahaha Dean look hilarious and damn get fat,joy,joy,fear,joy
GenevievePere23 WOW you call bully correct typo harsh,fear,fear,fear,fear
Theresa_Talbot Haha sorry about the dreadful pun need get out more cooped lately,sadness,sadness,sadness,fear
don give who win out and pine just worry about get drink Saturday nightðŸ,sadness,sadness,fear,sadness
true there impulsive thin skin bully who like silence critics amp opponents president voxconversations,fear,fear,fear,fear
mhchat Childhood experience inform adult relationships have associative memories Not question ability process,sadness,fear,sadness,sadness
resentment and hatred the destroyer your fortune today,anger,anger,anger,anger
Michelle cry again shock bitter just not that into you TeamNicole,fear,anger,fear,fear
name anxiety and have shaun,fear,fear,fear,fear
can believe make this far 169 days throw out demons get sober clean start recovery Sobriety,sadness,sadness,sadness,sadness
trade have fun conversation kik youraffair kik kikme messageme textme pics trade tradepics snap bore,anger,anger,anger,anger
SteveStratford9 PaulTowheyJr ClassicDrWho BBC all those will get animate IMO Companion change Monsters Classics,joy,joy,joy,joy
skydrive cokie hearty exactment blame online HEpHXhO,joy,joy,fear,joy
Are you worry worry n1Peter nThrow all your worry him because care for you faith leadership mindfuâ,fear,fear,fear,fear
past midnight loud bang our front door tell about new rape case Edinburgh today nosleep,joy,joy,fear,joy
yards off the pace League Cup game against Northampton Town Let that sink for moment MUFC,sadness,sadness,sadness,sadness
Working you feel your life The Edge_Could either way lose all reason for Living JesusChristHealsSavesASK fatloss,sadness,sadness,sadness,sadness
want watch some netflix but stick here class depress,sadness,sadness,sadness,sadness
the juniors now wear purple ollafest while here fight with alarm about when need wake for German sadness,sadness,sadness,fear,sadness
You welcome and thank you likewise What you hop learn like your concern,fear,fear,fear,fear
LordDerply for like yugioh for animate show,joy,joy,joy,joy
kinda girl please the dick rightðŸ,joy,joy,sadness,joy
you right choice have slam him one ignorant man and really resent that statement Don King embarrassment,anger,anger,fear,anger
panic sweat sneeze hiccup snot tear cry Clearly body have issue with chilli,fear,fear,anger,fear
want peace from WorldPeaceDay internationaldayofpeace,fear,fear,fear,fear
Sorry wow_air definitely with Icelandair next time this beyond unreasonable yourappologiesmeannothing,fear,fear,fear,fear
try not let anger seep into review but resent have time waste book like that Time precious,anger,anger,anger,anger
DISTRACTION what really selection election Syria race riot GasCrisis2016 NoDAPL rape,fear,fear,fear,fear
The Worst Place You Can Your Own Head quote worstenemy depression thinktoomuch,sadness,sadness,sadness,sadness
stop watch gotham cause they drop off tabitha and barb relationship and make her pine after the main,sadness,sadness,sadness,sadness
jwonder81 well course Progress for the sake progress must discourage The problem the substance the rhetoric,sadness,sadness,anger,sadness
need serious nap,sadness,sadness,sadness,sadness
sorry discourage you,fear,sadness,anger,sadness
the only one with park sensors who still manage reverse into things nightmare,fear,fear,fear,fear
RealKyper watch the jubilant scrum the end the day and remember they all still kid priceless,joy,joy,fear,joy
Chris Williams yards shy join yard club Bowman 279 Walker 168 amp Roosevelt 095 already there CFL,fear,fear,fear,fear
more entertain and frighten than bitter alcoholic try desperately get your attention,anger,anger,anger,anger
sure you have heyday they,joy,joy,joy,joy
only talk ask how things just get say something want 4give not elate start conversation with,fear,fear,fear,joy
better really stupid don worry,fear,fear,fear,fear
not very young man compile info smile baby then mattress create new evil,joy,joy,anger,joy
this the internet age get mad out any and all proportion and assume the terrible worst with little facts knowledge,fear,fear,fear,fear
Day harvest16 listen the sound the chopper work way closer home make happy farm365,joy,joy,fear,joy
just begin ladies and gents The war racism have begin sadness Segregation continue smh,sadness,sadness,fear,sadness
Utd shamble that horrific,fear,fear,fear,fear
wan kill you and destroy you want you die and want Flint back emo scene anger fuck die hatered,anger,anger,anger,anger
get cheat when mistake the sparkle ribena the normal ribena,sadness,joy,fear,joy
insult compliment tell look like really happy duck,joy,anger,anger,anger
ThomasHCrown historic evangelical wonder the Donatists have point What dreadful clergy fmr circle,fear,fear,sadness,sadness
down payment problem you may never have Joyce Meyer motivation leadership worry,fear,fear,fear,fear
primarily the person youâ talk rather than yourself and the impression youâ make lessen social anxiety,fear,fear,fear,fear
get depress,sadness,sadness,sadness,sadness
fix this home away deptch chart invalid glitch have close madden and open everytime this happen,sadness,anger,fear,anger
can never find the exact emoji that after the exact moment that need panic,fear,fear,fear,fear
beautiful day today Cloudy but sunny and breezy,joy,joy,joy,joy
ANI_news Pakistan should stop cross border terrorism they really need solution for KashmirIssue sir India should act,fear,fear,fear,fear
make better_world depress when failure,sadness,sadness,sadness,sadness
what you have amp enjoy your life nUse your smile help others use theirs,joy,joy,fear,joy
the Oblivion score drink coffee research for new sci animate project,joy,joy,fear,joy
Lord thy God the midst thee mighty will save will rejoice over thee with joy nZephaniah KJV,joy,joy,joy,joy
awe that adorable,fear,fear,fear,fear
Just because hurt nDoesn mean hurt nDoesn mean didn get nWhat deserve nNo better and worse lose,sadness,sadness,joy,sadness
DemPhillyEagles StonedPhillyFan don ever compare those scrub ben shake off your whole and throw,fear,fear,fear,fear
self Stop laugh things that offend you get mad people NoteToSelf mad upset,anger,anger,anger,anger
job train too much meat eat well Also get approve drive for Lyft Just need car day35 sober,sadness,sadness,fear,sadness
love those memories that randomly pop ninto head have smile like idiot for age ó¾Œ,joy,joy,fear,joy
cry out fear clear path nBut Voice seem silent chase rat nAm just indoor expect open door weak wise fool,fear,fear,fear,fear
Really sad amp surprise side Russia fight against amp the other support Pak which epic centre terrorism,fear,fear,fear,fear
much news about Pakistan Afghanistan etc need more cheery news about Frybread Stands Everyone media just grim,fear,fear,fear,joy
FOXTV you use the warblers set from glee the episode about the acapella college kid,joy,joy,fear,joy
father the bride speech minutes she tell him wrap for more minutes,fear,fear,fear,fear
frustration look Elphaba frown aggravation Her high pitch voice grow more and more,anger,anger,anger,sadness
expensive but rather take bigger female there than tiff You all see how slim she and how she love eat,sadness,anger,sadness,anger
find marmite Australia happy,joy,joy,joy,joy
something about English sparkle wine would good farmhouse cider Italian cocktails Thanks,joy,joy,joy,joy
should have stop after smile Being rude not the same funny just mean bully stoppickingonwomen,fear,fear,fear,fear
wan fright fest with squad,fear,fear,fear,fear
just try home tonight run 2nd and and run 3rd and That what champ sike losers terrible,fear,fear,fear,fear
wait for Yang Guess she really need her sleep something Kittens feel kinda deject right now Offline,fear,fear,sadness,sadness
BoardEveryday turnorder 80s new wave techno jazz blue depend mood,sadness,sadness,sadness,sadness
should merely hide where frown have Mark Twain,sadness,sadness,sadness,sadness
Zika Hoax Files DEET part binary chemical weapon target your brain Toxin neurological USCitizens Insect mammal,fear,fear,sadness,fear
JaySekulow what can get reveal his tax That the immediate danger But will not answer,fear,fear,fear,fear
Sam grin against Steve lips murmur his word with playful tone You want the shirt off sure could accommodate,joy,joy,joy,joy
seriously frustrate sometimes ugh rag,anger,anger,anger,anger
lgbt person tell someone else that how they identify isn valid sad and against everything should stand for,sadness,sadness,sadness,sadness
tear inappropriate This day holy our Lord not grieve for the joy the LORD your strength Nehemiah NIV joy,sadness,sadness,fear,sadness
just sulk peace,sadness,sadness,sadness,sadness
FEET away from shoot victim during protest say skeptical official story CharlotteProtest CharlotteRiot,fear,fear,sadness,fear
madden the reason why controllers snap,anger,anger,anger,anger
WTF NYSCHereToHelp allow gym atmosphere jumpship nasty atmosphere unprofessional,fear,fear,fear,fear
Watch this amaze live broadcast musically,joy,joy,joy,joy
nothing like the shower when the power out creepy,fear,fear,fear,fear
tip for everyone Stop offend End offend quit youredumb liveyourownlife,anger,anger,anger,anger
sober weekend,sadness,sadness,sadness,sadness
ArchangelSummit Anyone can brave but you just have last mins longer than everyone else leadership,fear,fear,fear,fear
not fan The Beat Happening But that not discourage aspire other Olympia musicians KUOWrecord,sadness,sadness,joy,fear
polish nail but can find the polish remover look like 3yr old polish nail lol,fear,fear,fear,fear
how sad fan gona when they get eliminate Man that gon Nirvana religious experience rejoice their misery,sadness,joy,sadness,joy
not just treat for viewers watch janak simply treat for our soul mind thoughts hearty respect,joy,joy,fear,joy
any you ever stay hostels overseas only frame reference the movie Hostel and all know how that,fear,sadness,fear,sadness
mine pass know inconsolable amp devastate For while,sadness,sadness,sadness,sadness
500k 50k 25k 10k You fuck bb18 bitter shouldofVotedforNicole,anger,anger,anger,anger
attack usa pay mind lol,fear,fear,fear,fear
every fear,fear,fear,fear,fear
yeah dude Appreciate the support Notorious ABC peep grateful,anger,anger,fear,anger
Heather that hilarious MsHeatherBates pattonoswalt AnthonyWeiner 15gets20 NYC,joy,joy,joy,joy
4yo blast gothcore music She have anxiety amp can listen around her bcuz too spooky sigh momlife,sadness,fear,fear,fear
ddcl2519 not nice Wishing harm another human deplorable Your comment show how human and humane you bully,fear,fear,fear,fear
Happy Birthday cheerchick jeep jeepgirl IDriveAJeep jeepjeep Cheer,joy,joy,joy,joy
you still discourage mean you listen the wrong voice amp look the wrong source Look the LORD,sadness,sadness,sadness,fear
Hoping hear some serious tonight,sadness,sadness,sadness,sadness
may have induce these seed mine sleep,fear,fear,fear,fear
tate think wind the willows serious play can wait see him play sing badger,sadness,sadness,sadness,sadness
offense can score redzone trip point lbs can pull flag miss flag that lead dat take league,sadness,anger,fear,anger
AskTrumponeQuestion why you bully and insult people much more than any other candidate history Not leadership,fear,fear,fear,fear
sorry for your divorce but don worry will good wife then reference,fear,fear,fear,fear
anxiety attack turn into Panic attack fuck ugly,fear,fear,fear,fear
2nd step beat anxiety depression realise that not about wait for Take action yourself now,sadness,sadness,sadness,sadness
return Matt Damon and director Paul Greengrass bring back all the exhilarate rather face entertainment movie,joy,joy,fear,joy
think fun and not fun but the bright side don have fight for park,joy,joy,joy,joy
honor take such role their joyous day Hopefully don fuck,joy,joy,fear,joy
When mirth the order the day ought honour most who give most mirth the greatest number Laws,joy,joy,joy,joy
She laugh bite course Aria shake her head calm her mirth she could listen Mikey actually,joy,joy,fear,joy
see when smart CowboysTwitter folks chirp the same stuff you during your review This why join,joy,joy,joy,joy
ƒWhen life show you have hundred reason cry show that you have hundred and one reason smile quote,joy,joy,joy,joy
how stop that horror movie theme commercial Suddenly hear scream really not make want watch twitch anxiety,fear,fear,fear,fear
hate that you unhappy your bill keep What unique feature you want with your plan RobertS,fear,sadness,sadness,sadness
EndTrumpweek please depress,sadness,sadness,fear,sadness
terrible Paul deserve that win bbfail,fear,fear,fear,fear
You all our angelic comrades,fear,fear,fear,fear
BroggersM19 have retire minutes ago most blue here,sadness,sadness,fear,sadness
Anyone else find anniversary windows update 1607 Complete nightmare,fear,fear,fear,fear
Fingers cross can finish all work early enough this Friday time catch LIB nervous timetogrind,fear,fear,fear,fear
shower lay bed for about hour then dread wear pant for the remainder the day,fear,fear,joy,fear
the nicest way tell someone cheerfully whistle outside apartment door that will end them should they continue whistle,joy,joy,anger,joy
but that cute Atsu probably shy about photos before but cherry help her out uwu,fear,fear,fear,fear
only good thing madden,sadness,anger,anger,anger
bet fume with our draw,joy,anger,joy,anger
girls who playful and childlike seem have such lovely relationships Can imagine them have serious convos but cute,joy,sadness,sadness,joy
Asylum The place where optimism most flourish,joy,joy,joy,joy
girl bitter,fear,anger,fear,anger
awe thank you much love,fear,fear,fear,fear
Starting get butterfly our tummies about tomorrow who will win nervous,fear,fear,fear,fear
night room pollute with syringe notebooks and shadow move this kind night Away melancholy away,sadness,sadness,fear,sadness
might make look weak but the weakest person the one who hold anger hatred and revenge,anger,anger,anger,anger
can you blame the manager watch these players play abysmal Our team dreadful Jose can save one can mufc,sadness,sadness,anger,sadness
andreamitchell say not only not play HRC campaign her but not discourage 3rd Party vote TRUE,sadness,sadness,fear,sadness
survivor back SurvivorMillennialsVsGenX happy see you happy,joy,joy,joy,joy
see the elder watch during community hours and honestly don have idea about what assignment will,fear,fear,sadness,fear
really amaze the money they give some these nfl texans brock,fear,fear,fear,fear
unfortunate that after all these years still struggle with depression smh,fear,sadness,sadness,sadness
pls dont insult the word Molna,anger,anger,sadness,anger
get embarrass the slightest things and then fret about all day hate,sadness,sadness,fear,sadness
dumb ass hell lolol LethalWeapon,joy,fear,fear,joy
Miss Cookie send her thank She not spry she use like She doesn have the adventure the young pup,joy,joy,fear,joy
Jauregui make all problem dissapear amaze sadness She keep strong,sadness,sadness,fear,sadness
queue for minutes Now put through Sport dept cancel back queue again,fear,fear,fear,fear
Now what for the next hour while wait for OurGirl start,fear,fear,joy,fear
whip boy mufc sad,sadness,sadness,sadness,sadness
horrible pun for the day have make shall return cage dark corner myself while cry amp laugh hysterical now,fear,fear,fear,sadness
the FirstDayofFall and happy Sipping PumpkinSpice flavor coffee and smile Happy Fall everyone amwriting,joy,joy,joy,joy
time for most joyous celebration ðŸŽ,joy,joy,fear,joy
what just happen need smoke,fear,fear,sadness,anger
loss city the cup next cmon unite,sadness,anger,anger,anger
away please beg depression anxiety worry fear sadness nDreams joy and baby find Sits AndisBench,sadness,sadness,sadness,fear
love the center attention every way nalso get nervous talk front class,fear,fear,fear,fear
Headed MDW layover SLC Got off for food Wrong move Bailed food amp barely make WannaGetAway Contest,sadness,sadness,fear,sadness
lovely brownie call tuppytupperware its awful,fear,fear,fear,fear
Watch this amaze live broadcast lively musically,joy,joy,joy,joy
ughh just want all this over like nightmare can all just get along,fear,fear,fear,fear
dash and divide like million star the night sky,sadness,sadness,sadness,sadness
now really excite for November Hope they not all horrid chavs though,fear,fear,fear,fear
condemn MenForChoice but haven see any you criticize the dismal American foster care adoption system,fear,sadness,fear,sadness
have charisma guess you like people who look coke out and speak they school bully,fear,fear,fear,fear
love company The church ought place where find none Pastor Kris Theobald joy,joy,joy,joy,joy
goal achieve something that big exhilarate that excite you amp scar you the same time BobProctor,joy,joy,fear,joy
hygge candle jasmine tea amp GBBO,joy,joy,joy,joy
always tell that they don expect have anxiety because generally cheerful and don act the way they expect,sadness,fear,fear,joy
they cover these police shoot fairly well they dont want miss chance bully you,fear,fear,fear,fear
goodness love this rainy day head down creative cap amp get lose your thoughts kind day art create biz,joy,sadness,fear,sadness
Spacekatgal Its okay trans just rejoice with the trans the trans way the way not your business why care,joy,fear,fear,joy
never think angry oompa loompa would Boggart but there you have boggart PresidentTrump nightmare,fear,fear,fear,fear
that 2016 757 airplane not have WiFi ridiculous AmericanAirlines americanairlinessucks AATeam horrible,fear,fear,fear,fear
medicine burn,joy,anger,anger,anger
cook and breezy should get back togetherðŸ,joy,joy,joy,joy
cat bloody lucky the RSPCA weren open 3am last night fume,anger,anger,joy,anger
don think Ian know Pavel know about Charlie bet Rob will cackle with glee when hear what have happen thearchers,joy,joy,fear,joy
Has anyone notice that stories recent days all paint positive accomplishments for Trump and challenge for Hillary surprise sad,joy,sadness,sadness,sadness
look some the average players that play the min and pine Nani Rafael RVP,sadness,sadness,anger,sadness
Americans think the media nothing but Government propaganda lie control RiggedSystem distrust garbage oreillyfactor,fear,fear,fear,fear
RealJamesWoods saddest part this whole mess that all this anger misdirect they should march the WhiteHouse,anger,anger,sadness,anger
ChrisWarcraft species Don refugees Skittles know like his snack but even frown talk about eat humans lizardscum,anger,anger,anger,sadness
scar that coworkers submit one those wardrobe makeover show fashion,fear,fear,fear,fear
wed two weeks and actually really nervous just want things right don want get sick get cancel,fear,fear,fear,fear
jessespector old rich white religious guy support republicans Not shock all,fear,fear,fear,fear
the sadness leave you break your bed will hold you the depths your despair and all the name love ðŸŽ,sadness,sadness,fear,sadness
Less sugar more fruit Less soda more water Less worry more sleep LESS WORDS MORE ACTION,fear,fear,fear,fear
AND his momma worse than Tony sopranos momma wow history major,sadness,sadness,fear,sadness
BrightPigSEO provide dignify and professional funerals price families can afford satisfy clients bright pig,joy,joy,joy,joy
lose and walk cry Corbyn supporter and whisper Don mourn Organise nAnd laugh and laugh,sadness,sadness,joy,sadness
Better mood today Bring tease flirt xdressers laughter and roleplayers Also confessions and secrets,joy,joy,fear,joy
person renown cheerful expectation solutions pleasure principle back HsNHZMJSc,joy,joy,fear,joy
roommate okay that can spell because have autocorrect firstworldprobs,fear,fear,fear,fear
girl new school pretty,fear,fear,fear,fear
problem just felt like speak because felt the same before and want you overcome and not discourage,sadness,sadness,sadness,fear
LaneWoolery experience all play role that education and preparedness not fear,fear,fear,anger,fear
fine the mat tonight with without sleep theres worry for that this side the water,fear,fear,fear,fear
This not brown nose but listen lot house minister but nhf16 impress more than any optimism,joy,joy,fear,joy
depress how despicable Trump with policies campaign bigotry amp rancour can close evil immoral disaster,sadness,sadness,sadness,sadness
people have much negativity fill inside them but always happy that such gloomy world someone like exist Namjoon,sadness,sadness,joy,sadness
the Grand Old Paradox that fear the encroachment the state but love unconditionally its pay enforcers,fear,fear,fear,fear
yesnicksearcy Although don expect trumpie understand the difference between real things and pretend things,sadness,sadness,fear,sadness
What Hillary have different controversies and she get ask NOTHING about any them Truth she horrible candidate,fear,anger,fear,fear
That overtime exhilarate Out seat and the hand mackinnon wow WCH2016,joy,joy,joy,joy
Impractical Jokers practically genius laughter good4thesoul ImpracticalJokers bingewatching,joy,joy,joy,joy
like talk someone who make laugh laughter the best medicine,joy,joy,joy,joy
prepare Not far know her dull reply There still survivors members from Like say,sadness,sadness,sadness,sadness
the butterfly stomach anxietyproblems,fear,fear,anger,fear
afternoon delight,joy,joy,fear,joy
