Content,NB_Emotion_Predicted,SVM_Emotion_Predicted,KNN_Emotion_Predicted,Emotion_Actual
the foundational key all success Pablo Picasso inspire quote action hustle dosomething success,fear,fear,fear,fear
here again restless,fear,fear,fear,fear
can stop smile,joy,joy,joy,joy
don know try not fret sweet little pupper,sadness,sadness,sadness,sadness
therealkers awe miss your sweet smile Come visit and sometime when not all workingðŸ,joy,joy,fear,fear
direction play hale and hearty situation child evolvement CMmyd,joy,joy,fear,joy
Valley win home competitive cheer invite with score 158 Dell Rapids second 138,sadness,joy,fear,joy
insist that you give your best insult first,anger,anger,anger,anger
internationaldayofpeace everyone hop that the world become better place less division more happiness keep smile,joy,joy,fear,joy
hope you never day without something make you smile You deserve all good things Please follow šðŸ n311 553,joy,joy,joy,joy
burn out keep yourselves fuel and aflame alert servants the Master cheerfully expectant Romans,joy,anger,joy,joy
Are you worry worry n1Peter nThrow all your worry him because care for you faith leadership worry mindfuâ,fear,fear,fear,fear
have leave Maine sadness,sadness,sadness,sadness,sadness
Hey how find play history new ios10 appleMusic music lose,sadness,sadness,sadness,sadness
out wasn even anything concern about all happy and bite frustrate take long get this answer,anger,fear,fear,joy
not that the man not know how juggle just didn have the ball funny pun punny lol,joy,joy,joy,joy
shit about this tattoo nervous,fear,fear,fear,fear
she would frown bite fold her arm why that every time need assistance someone expect lil,sadness,sadness,fear,anger
hate not have the answer need tomourssuck prayinsnotcancer angry,anger,anger,fear,anger
your life yell Surprise surpriise chirp cheerfully with wicked grin his lips,joy,joy,joy,joy
SPARKLES proud little huff Still pose mind you,joy,joy,anger,anger
The hilarity you people not realise that racism racism regardless whether one use choice word hilarious,joy,joy,fear,joy
lmao can only imagine the frown across that face yours Hilarity,sadness,sadness,anger,sadness
You interview one irate group two filmmakers who don live here and get stock statements That not journalism,fear,fear,anger,anger
make post like open commission hour get slot while you can and like sit here awe that sort demand,fear,fear,fear,fear
nation with large part the population live fear the police neither great nor free actually fascist nation,fear,fear,fear,fear
just have steak pie supper tremendous,fear,fear,fear,fear
start glee from the begin cry they such baby love children,joy,joy,fear,joy
Loving Speechless_ABC far Just hilarious and wonderful hilarious Bravo,joy,joy,joy,joy
make him feel vigorous Fine You can kill now Said Hestia with display only despair rather than her joyful,joy,joy,fear,sadness
tell order will ship Sept arrive Sept Today the lie terrible whereismyfurniture,fear,fear,fear,fear
BOOK FRICKING INSANE LIKE HOLY CRAP panic,fear,fear,fear,fear
give cheerfully and accept gratefully everyone bless Maya Angelou,joy,joy,joy,joy
That lovely story actually see Ruth and hubby who win the cashcow funny when she leave the phone happy,sadness,joy,fear,joy
you need any assistance with your concern can resolve feel free email with your info,fear,fear,fear,fear
fear most usually what most need Tim Ferriss inspire inspire motivation fear success hustle,fear,fear,fear,fear
your journey unique Don get discourage because you compare your journey someone else You will get there,sadness,sadness,sadness,fear
yea lol catchy you fret,sadness,sadness,sadness,sadness
could have see her local mall any school football game dishearten,sadness,sadness,anger,sadness
nIsn OBrien suppose some sort offensive genius awful,fear,fear,fear,fear
You get watch the new series This wow Best show see long time tear laughter moretears,joy,joy,joy,joy
dont have feel grateful grateful for write all things work together for good for those who love God cheerful,joy,joy,joy,joy
Ointment and perfume rejoice the heart doth the sweetness man friend hearty counsel TruthfmDawnBreak,joy,joy,fear,joy
you truly want more God your life require let some the old things allow new things flourish stop,joy,joy,fear,fear
UPLIFT you still discourage mean Listening the wrong voice amp look the wrong source Look the LORD,sadness,sadness,sadness,fear
way ticket the blue,sadness,sadness,sadness,sadness
first you take the room now you wan beat bully,fear,fear,fear,fear
holy shit what the hell happen your lips Fix that shit mtv teenmom,anger,anger,anger,fear
spend his campaign divide people and pit them against each other His message fear and resent the other,anger,anger,fear,anger
pure the drive snow after piss multiple rabid dog,fear,anger,fear,anger
possible from cheery earlier the worst mood possible nowðŸ,joy,joy,sadness,joy
the android app design buggy and work sporadically fire box,fear,fear,fear,fear
heart because you leave for long again slight pout but turn smile nheheh just kid fine,sadness,sadness,fear,sadness
joyous first webiversary web mitzvah Smithsonian WeiPoints brianwolly jackie_mansky bethpylieberman bilbo,joy,joy,joy,joy
through the stress,fear,fear,fear,joy
Zika Hoax Files DEET part binary chemical weapon target your brain Toxin fear neurological USCitizens Insect mammal,fear,fear,sadness,fear
jamiesonhelen all three agin the pout,sadness,sadness,sadness,sadness
WelshGasDoc PlaidCymru supporter prejudice against disable people disabledlivesmatter bully bbcnews skynews,fear,fear,fear,fear
the EmotionalHedgeâ WPS elate about start Have mention TAMU,joy,joy,joy,joy
GucciShade KellyannePolls Who care Who care about tax form too believe terrorism and job what important,fear,fear,fear,fear
Tolumanda love true teach fear can illusion coach courage,fear,fear,fear,fear
spooky night disney fortwilderness campground disneyworld powerfailure dark,sadness,sadness,sadness,sadness
beyond mad that lose track brown spider brown carpet Where you will sneak frighten,fear,fear,fear,fear
you guy still down When can panic,fear,fear,fear,fear
ikhras Amal Clooney should try prosecute Bush Blair for war crimes that turn our World upside down amp create terrorism,fear,fear,sadness,fear
gon give this KKk police bitch the minimum sentence just wattch angry,fear,anger,fear,anger
morningmika amp her HillaryClinton Super PAC Morning_Joe MSNBC full panic mode over momentum TrumpPence16 MAGA,fear,fear,fear,fear
you guy still down When can,fear,fear,fear,fear
nervous could puke,fear,fear,fear,fear
CornflakeDaddy Yeah soo horrific need sit down,fear,fear,fear,fear
sparkle water make your life sparkly,joy,joy,joy,joy
Americans for HRC Now maybe you see the world get rid terror save their countries you get the DEMS out,fear,fear,joy,fear
KimPiggie every people can make tipo terrible bully them about that trvial and very sad,fear,fear,fear,fear
you get thisðŸ staystrong smile yourebeautiful,joy,joy,joy,joy
instagramers Selfie BestMeSelfie Smile BestMeCameraIsGreat EmojiGrid LikeforLike Friend Girl Boy Tattoos Family 6Pack,fear,joy,fear,joy
glee glee glee glee gLEE GLEE LOST LOST LOST lowe much,joy,joy,joy,joy
Gilmour biggest compliment King ask him after gig bear Mississippi pinkfloyd theblues davidgilmour blue,sadness,sadness,fear,sadness
yeah whatever whahibbi muslims just sect you know islam synonymous with rape and,fear,fear,fear,fear
and off the hospital Elouise water have panic Labour LittleSister superexcited,fear,fear,fear,fear
excite for the FirstDayofFall amp the rest the season have Halloween scare events cover for the next week,fear,fear,fear,fear
Loving Pitch far PITCHonFOX chill smile,joy,joy,fear,joy
dreadful temporada,fear,fear,sadness,sadness
just kill spider big spray spider gut like horror movie ugh revenge,anger,anger,fear,anger
slither from her ears and wrap itself around her neck like the boys she want love her mpy vss quote depression poetry,sadness,sadness,joy,sadness
hit the sink with hammer sorry the universal modifier,fear,sadness,fear,sadness
the thread and thing doesn like like that idk shy and secretive ugh,fear,fear,fear,fear
the first time madden career just set farm account Should make MOTM much easier,anger,anger,anger,anger
FieldYates MatthewBerryTMR Stephania_ESPN MikeClayNFL goddamn the celebrity draft the end classic,joy,joy,fear,joy
episode today Whilst edit there power outage will rebuild tomorrow podcast lose edit fail tomorrow,joy,sadness,sadness,sadness
thank Ryan amp Brad for scary the shit out the first episode Don think heart will make through the,fear,fear,fear,fear
Darius article what convince that the time and money have sink into the IGDA past years waste Good read,fear,sadness,anger,sadness
literally Nicole already have her chance and she play shitty both season bitter,anger,anger,anger,anger
Watch this amaze live broadcast lively musically,joy,joy,joy,joy
when you shine nYou know how feel nScent the pine nYou know how feel nFreedom mine know how feel feelin good,sadness,sadness,fear,sadness
Loving challengesophie talk challenge fear map inspiration stayunstoppable,fear,fear,fear,fear
One choose the CLP members seat not for people dole out their mat elect candidates,anger,anger,anger,anger
life never understand why anyone would pay money see,fear,fear,sadness,fear
never let anything below concern,fear,fear,fear,fear
ever want chance psyched start this new chapter newbeginnings timetoprovemyself morethanready,fear,fear,fear,fear
gloom,sadness,sadness,sadness,sadness
perception See someone else You also some level have that within you anger worry,fear,fear,fear,fear
have hard time fall sleep and wake several time because afraid bug crawl and end wake with bite,fear,fear,fear,fear
the drink man the bus who piss bottle and the seat,sadness,anger,fear,sadness
MCHorseFayse bockaguyjim generalgoodsman you own losers Twitter,fear,fear,sadness,sadness
noo nomorehammocks nightmare,fear,fear,fear,fear
depress that darker much earlier now,sadness,sadness,sadness,sadness
cant live anymore roblox get termianted sad killme lol robloxgamer,sadness,sadness,sadness,sadness
get see her last when she lively and talkative and able tell her love her that what matter,joy,joy,sadness,joy
that where Brian Where invite offend,anger,anger,anger,anger
EmilySmissaert shock revelation,fear,fear,fear,fear
start get Chris Sutton off our campaign Spread the work pundit noclue,fear,fear,fear,fear
pout just want Adrian appear and tell stop pout else,sadness,sadness,sadness,anger
DaniQays ohh here come sense from terror support stone pelt vandalize ppl who gather protest announce,fear,fear,fear,fear
age joyful elevate hope with the,joy,joy,fear,joy
all friends bnc mean and feel terrible hahaha,fear,fear,fear,fear
name DarthVader feel like need puff inhaler rapper but that some sick bar bar rap,fear,fear,fear,fear
health insurance win cover TMS but they let know they cover ECT mentalhealth psychology depression TMS ECT,sadness,sadness,sadness,sadness
may have induce these seed mine sleep restless,fear,fear,fear,fear
idea just exhaust and tidy room and just burst out cry,fear,anger,anger,anger
like bridge the divide between Right and Left Twitter and say that the new Tweet truncate thing fuck awful,fear,fear,sadness,fear
aspect human evolution the evolution consciousness attachments desire apathy sentimentality tear,anger,fear,fear,anger
you You not worthy enough know what serious,sadness,sadness,sadness,sadness
have problem Yes Can you something about Than why worry,fear,fear,sadness,fear
Nothing lovelier than your great mate send the most joyful and sweet pic Thankyou amy,joy,joy,sadness,joy
tend them get infections nHe frown and look down this nIt must hurt damn,sadness,sadness,sadness,sadness
nephews cousins nowhere near bad guy but they could kill any moment cop that think they their color,fear,fear,fear,sadness
Watch this amaze live broadcast musically,joy,joy,joy,joy
cheerful sloth annotate old book about very good man then the gods end evil,joy,joy,fear,joy
musician can tell you that more people get discourage when learn because shitty instrument than anything else,sadness,sadness,sadness,fear
content Life too short smile,joy,joy,joy,joy
dude same fukc lose spectacles this morning,joy,sadness,sadness,sadness
love that Jordy revenge âš½ï,anger,anger,anger,anger
didn say anything bad about the situation great mate can believe some Makes despair humanity,sadness,sadness,sadness,fear
joyous Worried would disappoint Most definitely not chickflick giggle comethefuckonbridget,joy,joy,joy,joy
just add little levity,joy,joy,joy,joy
DOJ have destroy USA These CharlotteProtest act terrorism date back Ferguson Terrorism how should treat,fear,fear,fear,fear
have all brace and can stop smile ŠðŸ ŠðŸ ŠðŸ ŠðŸ,joy,joy,fear,joy
block bless faith unlock them ManUp faith,fear,fear,fear,fear
great mind think alike,joy,fear,fear,joy
quick listen slow speak and slow anger,sadness,anger,fear,anger
envy the relentless your cheerful smile aim the pour rain your positive attitude art you have continually master,joy,joy,anger,joy
5679787 Can not you don follow each other Not such delight party fail letdown,joy,joy,joy,joy
what seem more fun for photo booth able instantly post Twitter have wait till sober see the hot mess,sadness,sadness,sadness,sadness
girls earn the Stonington today Goals Waite and Winakor DeluciaAlexis assist relentless,anger,anger,anger,anger
hotelplanner stay hotel who pack picnic lunch take the road BetterTogether Redlizzy1 NewfieChic,sadness,sadness,fear,sadness
Yes but you specifically fume about him not sign enough people,anger,anger,anger,anger
break heart see people down upset will try best make them smile cheer them,joy,joy,fear,joy
future must bright,joy,joy,joy,joy
JlKelly1 get teampaella present their way for you and but don think they arrive Saturday sadly,sadness,sadness,sadness,sadness
sadness This too shall pass lose lonley startingover,sadness,sadness,sadness,sadness
second artist announcement look good bluesfest2017 blue Music byronbay,sadness,sadness,sadness,sadness
have only just start watch glee this week now addict glee GLEEK,joy,joy,joy,joy
sulk too much for own good,sadness,sadness,fear,sadness
Your ass look horrible that your face,fear,fear,fear,fear
BaileyDemented ill kill bully her,fear,fear,fear,fear
LmRyle tomcolicchio realDonaldTrump HillaryClinton understand your concern but look her foundation contributions worry,fear,fear,fear,fear
teach the blue keyboard fundamentals and all these classical major like WTF,sadness,sadness,anger,sadness
start good day without cup tea tea start day goodday,joy,fear,joy,fear
for sweet princess arrive weeks this Saturday excite nervous,fear,fear,fear,fear
They ain away and don want see them hurt change hearts mind really our only option,sadness,sadness,fear,joy
could such crook stick delusional dim amp dark hearted dud surprise lose amp prob also ppl win let their crimes drop nwo imo,sadness,sadness,sadness,sadness
breakaway Lundqvist with tremendous save,fear,fear,fear,fear
you wrong will not hesitate block you and cut you out life completely one greatest talents,fear,fear,anger,fear
Literally die amp live the same time catch twitter you aren follow him your life BASIC,joy,fear,fear,joy
Update have yet hang out with but still hopeful optimism,joy,joy,fear,joy
third year college student and and English major Today the first time ever write essay without have panic attack,fear,fear,fear,fear
you get when you cross apple tree and pine tree ŽðŸŒ² nNothing You can cross pollinate deciduous and coniferous tree,sadness,sadness,fear,sadness
HillaryClinton Hypocritical consider the MiLLiONS dollars you and take from horrible people and spend yourselves,fear,fear,fear,fear
now feel the worry,fear,fear,fear,fear
say Teufel reassign within the organization before next year but wish sooner Mets thirdbasecoach terrible lgm,fear,fear,fear,fear
love parody account Well Vote for Trump lol,joy,fear,fear,joy
keep grind boy your life can change one year and even when dark out the sun shin somewhere,sadness,sadness,joy,sadness
the surfer girl and don speak the same language anymore justsaying sadness,sadness,sadness,sadness,sadness
rag storm bring own emotions sorry everyone enjoy the thunder,joy,anger,anger,anger
anybody need drown blue sea whiskey,sadness,sadness,sadness,sadness
weak amp despair our Mighty God near will give strength amp joy amp hope amp calm our inner fear just have faith amp trust,fear,fear,sadness,sadness
Anyone else find anniversary windows update 1607 Complete,fear,fear,fear,fear
win you let threaten all your plan insignificant,fear,fear,fear,fear
think the swallow and swifts have Photo nights ago not see since sad Autumn,sadness,sadness,sadness,sadness
million box office doesnt this movie justice Political not SnowdenMovie terrific thriller and love story,fear,fear,sadness,fear
step into the shower and spidey sense tangle immediately look and saw spider directly above head terror,fear,fear,fear,fear
overthinking like jus wan happy pls,joy,joy,sadness,joy
night thoughts Feeling restless,fear,fear,fear,fear
That what strive for Jamie Please don hesitate reach out you have any question along the way,fear,joy,fear,fear
HillaryClinton evidently feel above norms SHOW the tax return you have nothing,fear,fear,fear,fear
during the past mistake similar terror pretty remarkable,fear,fear,fear,fear
Woke nightmare 3AM couldn sleep any more take UseAllTheHotWaterShower Now have time read,fear,fear,fear,fear
samsteinhp stop the press say propose something racist shock,fear,fear,anger,fear
waitress recognise from last time there mop after interview haha,fear,fear,fear,sadness
all the United managers Twitter who form our fanbase Honestly despair time Just back the fuck team MUFC,fear,fear,fear,sadness
factor respect provocation bulb worm BnQo,fear,fear,fear,anger
grim night GetTheFireLit,sadness,sadness,sadness,sadness
thin lipped smile grace gloss lips she let blue peer over the woman constant delight always,joy,joy,joy,joy
weather change from sunny and bright gloomy just time match afternoon mood,sadness,joy,sadness,sadness
today arm silence lungs rejoice freedom insides have color too woman count jawbone become razor For free,joy,joy,joy,joy
different grocery store and they have have buy Helmann nLiterally shake right now,fear,fear,fear,fear
really want for fright night but really don,fear,fear,fear,fear
luck all Fury Haney players play this weekend the Future Stars showcase Frisco KGB town fury,anger,anger,anger,anger
would great but what the card crash happen twice nightmare,fear,fear,fear,fear
mourinho worry bring Ibra and Rushford panic,fear,fear,fear,fear
BurmanAJ rather see KYLE from bbcan play again and THAT say something,fear,fear,fear,fear
Michelle cry again shock bitter just not that into you TeamNicole,fear,anger,fear,anger
get mad over something minuscule try ruin somebodies life not like lose your job like get you into federal prison,anger,anger,anger,anger
ryleycathryn you discover the alarm rate which die and how important they our way life,fear,fear,fear,fear
the twinkie scare tbt,fear,fear,fear,fear
about our Problems our greatest Addiction Break the habit nTalk about Joys quote optimism problemsolving behappy,joy,joy,joy,joy
hell even see your face make fume,anger,anger,fear,anger
little things like that make angry,joy,anger,anger,anger
Every time hear jtkantor organ kick the new break into the goofiest smile,joy,joy,fear,joy
least Blake lively and Ryan Reynolds still together God bless what beaut couple,joy,joy,fear,joy
depress watch news today out 100 bullet news rape What wrong with people india shameless depress,fear,sadness,sadness,sadness
can not depict what feel right now feel jubilant yet anxious dunno seem like now have something worth wait everyday,fear,fear,sadness,joy
seamlessly set alarm use okgoogle Nougat Just tell Okgoogle what and she PersonalAssistant,fear,fear,fear,fear
not worry about anything but pray about everything,fear,fear,fear,fear
multiple comb simultaneously what like call impressive work snap ohsnap daamn,anger,anger,joy,anger
Wagging his tail the praise pause tilt his head she take the frisbee from him let out playful,joy,joy,joy,joy
can not believe the generosity pour out for but give everything have for Nick healthy and happy lose,joy,joy,joy,sadness
have serious separation anxiety,sadness,sadness,sadness,fear
can have alcohol sadly but only flare under very specific circumstances just need more careful,sadness,sadness,sadness,sadness
dark side the moon fact all dark nGerry Driscoll the end The Dark side the Moon,fear,sadness,sadness,sadness
Love your new show hilarious,joy,joy,joy,joy
felt like couldn control and here she give much herself selflessly please him His groan,fear,joy,sadness,joy
paraplyene just read and fun lighthearted and cheerful right double cavity for,joy,joy,joy,joy
know she horrible shit but wouldn make anything better the end but your choice,fear,fear,fear,fear
try turn off alarm this morning and turn all alarm instead,fear,fear,fear,fear
phone the sink earlier sound but everythin else work Prepared myself for life without music until put earphones,sadness,sadness,sadness,sadness
fuck sad when the person you love doesn try fight for your happiness when you anything for them,sadness,sadness,fear,sadness
Flirt simper pout repeat Yuck,sadness,sadness,fear,anger
many gloomy days,sadness,sadness,sadness,sadness
People use this hashtag brag about themselves not interest please others but please God,joy,joy,joy,joy
Can believe put their price They already know struggle pay bill amp win change package,fear,fear,fear,anger
trade have fun conversation kik youraffair kik kikme messageme textme pics trade tradepics bore,anger,anger,anger,anger
boy our weekday schedule crazy But matter how tire whatever take keep the smile Kai face from frown,sadness,sadness,sadness,anger
just when think this disgust man couldn sink any lower like Hillary his depravity character have bottom,sadness,sadness,sadness,sadness
chiropractor make,fear,fear,joy,joy
room make few apprehend leave out charcoal ownership UnZU,fear,fear,fear,fear
don tweet shit like this come back and haunt you like your other ones,fear,fear,fear,fear
the grind have REAL Working job amp school ksudsm ksu recruiter instructor tumble gradschool,joy,joy,fear,joy
much want normal little life wouldn suit get restless need just what want all time happy,sadness,joy,fear,fear
app just randomly log out write the last part college essay and lose all,sadness,sadness,sadness,sadness
all finish you will discover that never random thoughts restless CrossoverLife,fear,fear,fear,fear
Okay deepbreathes can this ªðŸ âšªï cheer cheer amp see you the other side peep AFLCatsSwans ProudlySydney,joy,joy,joy,joy
data steal 2014 and only now you tell,fear,fear,fear,fear
okay not dead but come back lovingly haunt your sweet asses,fear,fear,fear,fear
The secret all every industry just start somehow people forget that they never give you permission,fear,fear,fear,fear
biggest fear incurable STD and pregnancy mean they basically the same thing anyway forlife annoy weirdsmells,anger,fear,sadness,anger
you insult What you think just because look like this psycho more sane than most Gotham freak,fear,anger,anger,anger
ashleighjessica give that pout the firm,fear,sadness,fear,sadness
not sure what worse that the use Comic Sans website anywhere else comicsans,fear,fear,fear,fear
OMG CRYING HAHAHAHA ikaw talaga tagagising HAHA shet set alarm BUT FORGOT TURN but awake now,fear,fear,fear,fear
today just felt like maybe track isn for,sadness,sadness,sadness,sadness
don know how people can binge watch horror film ALONE,fear,fear,fear,fear
life downhill alarm rate,fear,fear,fear,fear
crush fictional and animate character instead real people,joy,joy,joy,joy
George Establishment unhappy Trump campaign brand his son low energy but could not have beat the others either,sadness,sadness,sadness,sadness
who have brave the storm brew,joy,joy,fear,joy
realisation that the last time watch swim lesson cos back work next week lead joyous bedtime worstoneyet,joy,joy,fear,joy
hangover all day Stood dish and now exhaust again GAD depression amp chronic pain anxiety pain,fear,fear,fear,sadness
rather dump gasoline all over myself and run into burn build than use Excel,fear,anger,fear,anger
Luckii change many ways Him scary but joyful feel make strong,joy,joy,fear,joy
night where depression win depression fml help,sadness,sadness,sadness,sadness
Your boy have nightmare,fear,fear,fear,fear
OKAY That jump scar the Poop out right there Bad dog BAD Total code brown favorite pant Damnit horror,fear,fear,fear,fear
difference between someone selfies when they happy unhappy absolutely amaze,sadness,sadness,sadness,sadness
Shame you show elephant hunt and kill,joy,joy,fear,fear
The worst customer service and lack professionalism from this service provider phoneprovider badbusiness terrible,fear,fear,fear,fear
Fibromyalgia have really bad lately which not good for mental state feel very overwhelm anxiety bipolar depression,fear,sadness,sadness,sadness
good vibes for doctor appointment tomorrow,fear,fear,fear,fear
the challenge that you may feel the exhilaration victory nTOMIHO IpaglabanMo TapingDay2,joy,joy,joy,joy
can believe HoustonTexans can put even point hugeletdown,fear,fear,fear,fear
afraid she the goat you libel people afraid goat libel,fear,fear,fear,fear
nMy goal would for all miserable yet jovial the others know civil but with realization self,joy,joy,sadness,joy
