Content,NB_Emotion_Predicted,SVM_Emotion_Predicted,KNN_Emotion_Predicted,Emotion_Actual
stop your merriment very annoy,fear,anger,anger,joy
from movienight pickup the phone amp start dial no1 will knw startups product service thy dnt tell the world,fear,fear,fear,fear
Are Source mindset philosophy thoughtsbecomethings news lifehack you LIFE PleaseRT ProblemSolving,fear,fear,fear,fear
can wait hear what have say about the brilliant Hawking should rich the poorest taste,fear,fear,joy,fear
the titans and wrath the titans ŒðŸ ¾ðŸ ŒðŸ ¾ðŸ ŒðŸ,joy,joy,fear,anger
loong year Browns fan Longer than normal and that sad,sadness,sadness,sadness,sadness
not angry with God because you not get what you want for God give most when you expect least,joy,anger,fear,anger
fancy have some those and have never put them should that Also vote jaunty angle then one will judge,fear,fear,anger,joy
you don know what patronus don think should have tell you,fear,fear,fear,fear
home cut grass the heat All wan out eat somewhere air condition pout AdultingIsTheWorst,sadness,sadness,fear,sadness
really just fuck ask that offend,anger,anger,anger,anger
That awesome what the odds that swap neighborhoods,joy,fear,fear,joy
Val might this week have take the rest the week off work mourn sure they understand GBBO,sadness,sadness,fear,sadness
start this week strong and still strong,fear,fear,anger,joy
why have wait hours call YOU back cancel order JUST place after already spend hours the phone,fear,fear,fear,sadness
side note you self medicate That not help that bury the anxiety that WILL manifest another way Heart disease,fear,fear,fear,fear
seem sad She stamp and run behind the sofa will have give her plenty love and affection more than usual,sadness,sadness,sadness,sadness
will beat you Always think gryffindor this whole new world for excite,fear,fear,fear,fear
Sure have Sydney too tough too quick and their team pressure too much for the Cats handle Motlop Cowan,fear,fear,sadness,fear
Over social share dark amp over web traffic come from darksocial LIFTSocial,fear,sadness,fear,sadness
wish appreciate for all When turn take care want break tire,sadness,sadness,sadness,sadness
the sink and make your bathroom shine,sadness,sadness,fear,sadness
Watch this amaze live broadcast musicallyjh,joy,joy,joy,joy
depress yourself compare yourself comparisons,sadness,sadness,sadness,sadness
NewYorker Trump presidency dark age for the USA and the world would most definitely take war Short amp Long term pain,sadness,sadness,anger,sadness
and despair feel look self and family Hubby fight years for this country work years for this govt,fear,sadness,fear,sadness
the big time after selection last night Absolutely buzz Bring the roach SG16 kickittomehigh nswgaa blue statevstate,sadness,sadness,anger,sadness
smile doesn always mean person happy Sometimes simply mean they strong enough face their own problems,joy,joy,joy,joy
Agree 100 Marshall another concern would much rather rest this game,fear,fear,fear,fear
Apple thank for ios10 update even the best app freeze and crash angry,anger,anger,sadness,anger
rate get make some things shake,fear,fear,fear,fear
don leave sad,sadness,sadness,sadness,sadness
head melt very tire but can sleep nightmare,fear,fear,fear,fear
thus begin week holiday holiday ghastinoir rest,joy,joy,fear,joy
don know what WiFi ISP Rivertide Suites Seaside Oregon use But 53ms ping best can get and test win complete,fear,fear,fear,fear
stop afraid just stop What you now free brave free honest healthy life live love,fear,fear,fear,joy
hit breezy every day make sure break boot First class friend right there,joy,joy,joy,joy
And waxen their mirth and neeze and swear merrier hour never waste there AMNDBots,sadness,joy,sadness,joy
yourself term opposition the cloud mirror phenomena almost always mistake,sadness,sadness,fear,sadness
that not easy blow the run play create the seam for Sua burst through,fear,fear,fear,anger
BillSwindell DePauwU have breakfast when see this blow cereal the sink,sadness,sadness,sadness,sadness
omg slow eng not very well and hand shake uhh help mee like this lil chicken now MoreisBetter,fear,fear,fear,fear
bear with not Twitter savvyðŸ real life Facebook person Help gain followers blog selfhelp,sadness,sadness,sadness,sadness
whole for the most part feel borderline despair the very least Looking situation out control,sadness,sadness,sadness,fear
you get thisðŸ staystrong yourebeautiful,fear,fear,fear,joy
weeks into the course and have have the kitchen sink throw still pull knives and fork out ears,sadness,sadness,sadness,sadness
when Khloe Kardashian host The Factor and she fuck terrible,fear,fear,fear,fear
yeah Squid face God madden xbox1 come see,sadness,anger,anger,anger
chiropractor make happy,joy,joy,joy,joy
attack the worst Feeling really sick and still shake should sleep depression,fear,fear,fear,fear
man long since play madden trash anymore,anger,anger,fear,anger
love new movie BlairWitch blairwitchproject HorrorMovies,fear,fear,fear,fear
that despite the absolute delight children and would feel have kitten our home the misery husband would feel more,fear,fear,fear,joy
walk miles today the most walk since get rhabdo Going back work tomorrow here hop okay nervous,fear,fear,fear,fear
Missing the 500th test match today not able witness like watch India shy indvsnz 500thTest,fear,fear,fear,fear
andiymouse jordana_brown sure just fine can always change beer cheer squad,joy,joy,joy,joy
amp anxiety IRRELEVANT nAnyone will EVICTED significant amount rent HAS NOT BEEN PAID mentalhealth aside CantPay,fear,fear,fear,fear
true sonicsatam serious and bite dark Aosth like super goofy and Looney toonie degree,sadness,sadness,sadness,sadness
actual nightmare,fear,fear,fear,fear
eat sushi shake for you,fear,fear,fear,fear
brother know know that his life not danger This gun law get people this country fear for their life White people,fear,fear,fear,fear
can pull myself out depression,sadness,sadness,sadness,sadness
relentless absolutely the only way success Never ever ever give,fear,anger,anger,anger
dull moment here,sadness,sadness,sadness,sadness
have drag,fear,fear,sadness,fear
Terence get lot anger issue from family and school,fear,anger,anger,anger
Heaven rejoice because they gain angel the Keifer family prayers,joy,joy,sadness,joy
kid 8am the morning nothanks rip the flower bed the root while their parent watch shock,fear,fear,fear,fear
its reflective the current political debate awful,fear,fear,fear,fear
maybe have different stay for sixth form But still the oppressive architecture uninteresting people,sadness,sadness,sadness,sadness
study skills terrible,fear,fear,fear,fear
you ever want await you the other side fear IfIWasTheOppositeSex AskAMan,fear,fear,fear,fear
can cheer for jigaboo,joy,joy,joy,joy
refuse live fear sotoventures,fear,fear,sadness,fear
peanut butter You some kinda pervert,fear,fear,sadness,fear
wish could live all reality where can grieve over people never meet bad get BROTHERS die leave and right,sadness,sadness,fear,sadness
miss gran sing Rawhide her deep baritone growl,anger,anger,anger,anger
sadly beautiful photo,sadness,sadness,sadness,sadness
When all your devices and teles fail just time for bake off gbbo,fear,fear,fear,fear
hate that black lady paint herself white the internet for laugh and like BadForm DidntLaugh,fear,fear,anger,fear
minutes yoga your breakfast routine will change your day preparation sunriseyoga bodyawareness health yoga smile stretch,joy,joy,fear,joy
nerdist How cool would animate the scene,joy,joy,joy,joy
DevilsAdvcate absolutely bore big Manchester United fan its really disappoint see them play ths dull bore way,sadness,sadness,joy,sadness
dark,sadness,sadness,sadness,sadness
look hilarious this too much,joy,joy,joy,joy
The Rock Jack Black and Kevin Hart you kid WTF ThisIsATerribleIdea,fear,fear,fear,fear
never call when your sober,sadness,sadness,sadness,sadness
actually maybe suppose die and donation save our live,joy,fear,fear,joy
the most twitter and snap,sadness,anger,sadness,anger
headache,fear,fear,fear,anger
dhoni bcoz calmness match win finishers proud miltirian dad husband wonderful humanbeing his smile,joy,joy,fear,joy
2nd step beat anxiety depression realise that not about wait for Take action yourself now,sadness,sadness,sadness,fear
when people realize that these riot just perpetuate hate Saying you boycott city lose,fear,sadness,fear,sadness
astockeyWTAE she terrific her job where she head miss that,fear,fear,fear,fear
just have eat way sobriety This hell journey back sober,sadness,sadness,sadness,sadness
afraid she the goat you libel people goat libel,fear,fear,fear,fear
ever just really irritate with someone love like god damn makin angry but love forgive but angry,anger,anger,anger,anger
think our defense here USC play well just need fix few things offense and can win the PAC this year,anger,anger,fear,anger
who cheer for sport team completely outside New Jersey piss off,joy,joy,joy,joy
ashamed ally you Pakistan sacrifice almost 500 civilians side you war terror,fear,fear,fear,fear
Thursday which mean Grey day TGIT,fear,joy,joy,joy
can destroy easily wholeworld come together great strength they could destroy this fear from humanity,sadness,fear,fear,fear
Just outside the gym hall and play education playful learn,joy,joy,joy,joy
shy failure nobler than immodest success,fear,fear,fear,fear
Losing the will live with business down hold for minutes amp whoever pick cut off fume NoWorkForMe,anger,anger,anger,anger
The40Bar See you all October 8th ready tear keeptalkin wreckinso the40 brandonmanitoba country rock blue,sadness,sadness,sadness,sadness
One choose the CLP members seat not for people dole out their mat elect candidates,anger,anger,anger,anger
have finally tell therapist about sexuality last frontier not sure can the fear SingleGirlProblems,fear,fear,fear,fear
sit home damn much that everything start irritate need get out the house myself,anger,anger,anger,anger
Fear best beast product God aTheism theism biBle christianity hell heaven purgatory psychology jesus,fear,fear,fear,fear
delight everything,joy,joy,joy,joy
applications for dbs and still wait Been over year now Going loose job thank unhappy crb,fear,sadness,sadness,sadness
not always how you start how you FINISH,fear,fear,fear,fear
Getting comedic relief during season premiere ModernFamily Just what girl need hilarious,joy,joy,anger,joy
fellow horror creepy dark stange story fan how your day followme and followback,fear,fear,fear,sadness
know this one those nights where take Act God fall asleep,fear,fear,fear,fear
prayers with the family friends amp members you mourn the loss Engineer Ryan Osler LODD RIP,sadness,sadness,sadness,sadness
the way wear the smile you give today you,joy,joy,fear,joy
add Paul Walker Xbox but just spend all his time the dashboard dark humor funny,sadness,sadness,sadness,sadness
your journey unique Don get discourage because you compare your journey someone else You will get there,sadness,sadness,sadness,sadness
thank for make super sad about Pizza freepizza,sadness,sadness,fear,sadness
eugenelaverty all the best Moto loose very talented rider,fear,fear,fear,fear
this the worst didn read all this whole first month school and have unit test friday awe man,fear,fear,fear,fear
you think humans have the sense for recognize impend doom,fear,fear,fear,fear
have reminders for birthday approach Too bad she consider acknowledge her existence affront,fear,anger,fear,anger
lmao clown own hair dread lmao,fear,fear,sadness,fear
tmobile store original note7 customer and zero result What guy terrible customerservice 2hour waittime,fear,fear,fear,fear
only thing scary about arm man try scare someone the fact that feel his arm only good for tryin scare someone,fear,fear,fear,fear
Buying early entry ticket mean fuck all expect complaint email when get home shock service,fear,fear,fear,fear
Thank you disney theme episode for let discover how amaze the,joy,fear,fear,joy
Don look You only very very unhappy NNGH get the email notif THANK YOU,sadness,sadness,anger,sadness
say this put out there whoever should support other people decisions not discourage them,fear,anger,sadness,sadness
have car liscence,fear,fear,fear,fear
much trouble don think the Rev will see the funny side our project,fear,fear,fear,fear
patriots have the lamest color rush jerseys the whole nfl madden hope they wear them tonight,sadness,fear,fear,anger
MCHorseFayse bockaguyjim generalgoodsman you own losers Twitter sad,sadness,sadness,sadness,sadness
marcavis always fiery but never radical,anger,anger,anger,anger
doesn work mob mentality mass hysteria monger oligarchy,fear,fear,fear,fear
can literally eat creamy pesto pasta top with grill chicken sun dry tomatoes asparagus and pine nut every single day life,sadness,sadness,sadness,sadness
AlZeidenfeld DavisMattek FI_GPP_Quotes LoughyFI terrible handle but owe whoever run lot GPPHallMonitor,fear,fear,fear,fear
have snap crazy,anger,anger,anger,anger
make life mission discourage anyone from use They will rob you blind,fear,fear,sadness,sadness
that draw lively EFLCup,joy,joy,joy,joy
thirsty for the chance disagree the leave that you don even realize when something affront your bigoted platform,anger,anger,fear,anger
annafifield all hand deck the post and the msm trump start lead fla,fear,fear,fear,fear
tommyrosen InTheRoomsCEO Always happy support you brother Keep that fire burn,fear,anger,anger,anger
Strongwomen terrify weakmen don let the bully wear you down Loving your consistency and truth rough time Hang there,fear,fear,fear,fear
have medically prove that laughter effective pain killer,joy,joy,fear,joy
they see the happy exterior not the hopelessness sometimes feel inside depression anxiety anxietyprobz,sadness,sadness,fear,sadness
the day cut and dye hair excite,fear,fear,fear,fear
88Palouseriver ABC rejoice everything time some moron take out the genetics pool,joy,joy,joy,joy
the bird chirp and the cow moo need listen the sound nature ensure that all well,joy,joy,joy,joy
try ask for cheeseburger with only onion amp mustard any McDonalds,joy,joy,sadness,joy
and fewer good horror offer from Hollywood every year have just get too old for this shit,fear,fear,fear,fear
grahnort wonderful experience watch you yesterday thankyou for the laughter,joy,joy,joy,joy
finkowska they happen expect your thumb all over the place glee interpret double negative,joy,joy,fear,joy
what happy look couple,joy,joy,fear,joy
say Teufel reassign within the organization before next year but wish sooner Mets thirdbasecoach lgm,fear,fear,fear,fear
Whoo welcome greet cheerfully,joy,joy,joy,joy
GambieRanger which why leader who encourage his supporters deselect such concern for many,fear,fear,fear,fear
other news legs hurt run 5kin26mins dreadful flatfeet,fear,fear,fear,sadness
the process see work option mentalhealth complexptsd,fear,fear,fear,fear
feel awkward that timid everyone,fear,fear,fear,fear
when all your happiness and all your sadness and all your feel dependent another person,sadness,sadness,fear,sadness
your toddler cop with the new arrival Has try kill her yet they cheerfully ask,joy,joy,joy,joy
Coffeeking12 inject little levity The person who tweet the coke rape tweet obviously idiot,joy,joy,fear,joy
the only person who dislike fall FirstDayofFall leave thingsdie depress cold noflipflops ŽðŸ ¾ðŸ ŽðŸ ½ðŸ ŽðŸ,sadness,sadness,sadness,sadness
After spend 450 offer voucher ask could spend weekend Was tell valid today only unhappy,sadness,sadness,sadness,sadness
Madrid play awful and modric but minutes BernabÃ stadium long Viallreal never win there,fear,fear,fear,fear
don kill die alarm rate,fear,fear,fear,fear
follow beautiful Snowgang Amynicolehill12 Princess fitness bodyposi haircut smile Whitegirlwednesday,joy,joy,fear,joy
make things easier and compact and less fiery burden the weight sexuality One release the transmutation,anger,anger,fear,anger
let them know the,fear,fear,fear,sadness
Watch this amaze live broadcast musically,joy,joy,joy,joy
whole VanRE extradition might turn into Pandora box have idea about that murky corrupt guanxi China Toad Dada,fear,sadness,fear,sadness
you truly want more God your life require let some the old things allow new things flourish stop start,joy,fear,fear,fear
gud premiere LethalWeapon funny and serious,joy,sadness,sadness,sadness
MLB Sam Dyson probably have flashbacks right about now,fear,fear,fear,fear
instinct only the reason human mind could kill animal never know despair,fear,fear,sadness,sadness
veteran just totally get out ticket elate right now close call,joy,joy,joy,joy
KingJames good hearts lose job Responsible families Information profile even dollar canâ just tweet,joy,fear,joy,sadness
LethalWeaponFOX promise wouldn live tweet but DamonkWayans ClayneCrawford bring and furious action FTW,anger,anger,anger,anger
happen breezy,joy,joy,joy,joy
But the lady the store say have nice eyelashes that good right optimism,joy,joy,fear,joy
visit downtrodden part town brave stunt More eleven,joy,joy,joy,sadness
magpies gather around help swoop terrorism,fear,fear,fear,fear
fear the want business man who qualify himself well for his call never fail employment,fear,fear,sadness,fear
jk_rowling Donald Trump the White House shudder,fear,fear,fear,fear
India afraid bad terrorism,fear,fear,fear,fear
Onision annoy the good love fan Onision include myself really annoy how people just too cheerful,joy,anger,fear,joy
broadband shock regret sign now angry shouldofgonewithvirgin,fear,anger,fear,anger
SenJohnMcCain Honorable Senator cheer when cease fire not hold PEOPLE DIE AND YOU CHEER GENOCIDE SUPPORT NOT GOOD,joy,joy,joy,joy
look that way But let think about Rohan last week,fear,fear,fear,joy
what highlight would imagine you will only have second highlight for the whole season far venkysout,fear,fear,fear,fear
Can you imagine the person who have spray tan him,fear,fear,fear,fear
sadness with resentment the past sadness with fear the future try live the now MHchat,fear,sadness,sadness,sadness
take what lose and break and make right,fear,sadness,sadness,sadness
kid the pool yell about get foot his ass shutup parent kid,fear,fear,fear,fear
They will formidable challenge Roy Hodgson Northampton Town shudder,fear,fear,sadness,fear
JackEvans711 you the best Whiney Jerkass Heel since heyday WCW LuchaUnderground,joy,joy,joy,joy
reach 100 subscribers happy goodday thankful,joy,joy,fear,joy
like that she not mop around all the episode She have moment emotional weakness felt sorry about,joy,fear,sadness,sadness
depression saddness afterellen shitsucks,sadness,sadness,sadness,sadness
weekend fall let see can stay discipline this season goals fitness run sober Mindset firstfriday family,sadness,sadness,sadness,sadness
fuck boil and not,anger,anger,anger,anger
CazuaL_WeaR look like book shape like gun optimism itsagunalright,joy,joy,joy,joy
Hails_Berry8 varsity pine rid,sadness,sadness,sadness,sadness
sorry about your loss one should ever give you shit for take your time mourn matter how long take,sadness,fear,fear,sadness
one those angry days will have stop watch news,fear,anger,joy,anger
Atlanta this Rockies and DBacks this That combine atrocious team,joy,anger,joy,fear
break tooth for long now have abscess Need dentist but fear make hard for and still can dentist,fear,fear,fear,fear
question you get Twitter make you want despair batter complain but aren convince things could better,fear,fear,fear,sadness
wan really out but can say Deffo have fear miss out,fear,fear,fear,fear
say lover pale green light nhe hover high where the moon shin bright,sadness,joy,joy,joy
think wouldn have deal with that fire alarm again today and then step into Mesa during their fire drillðŸ,fear,fear,fear,fear
doubt smile the best medicine ŠðŸ ŠðŸ,joy,joy,fear,joy
Watch this amaze live broadcast musically,joy,joy,joy,joy
nearly aesthetically please enough lol need this and not phone,joy,joy,joy,joy
have sleep cooties close eye and dream that awake weary sleepissues narcolepsy,sadness,sadness,fear,sadness
The irony that those protest about this kind stuff the Orwellian nightmare they think theyâ fight against,fear,fear,fear,fear
hmm you may have point think Twitter have get dull LAMINATION,sadness,sadness,sadness,sadness
This the most grim piece laughter stricken with all day,joy,joy,sadness,sadness
will the weeks full Mondays end,sadness,sadness,fear,sadness
over week until start new job Looking forward and cacking myself the same time,fear,fear,fear,fear
AMB4JC our job the job people who still sane still life help the lose find themselves amp love eachother,sadness,sadness,joy,sadness
sorry This heartbreaking and scary can happen there can happen anywhere Please safe,fear,fear,fear,fear
ain that serious HOUvsNE awful igotbetterthingstodotonightthandie,fear,fear,fear,fear
not nervouswreck pileup GoingCrazy HelpMe Insane Antisocial,fear,fear,fear,fear
friends send ballons and fireworks through text amaze smile,joy,joy,fear,joy
shabazz name phone easy breezy beautiful amp will not apologize,joy,joy,joy,joy
tear MLC play football Knees serious business Take care them Lem know you need anything,sadness,sadness,sadness,sadness
you could leap your feet dramatically plant one foot the seat your chair and let out that jaunty tune,sadness,fear,sadness,joy
LordÂ turn his face toward you and give you peace Numbers truth trust promise calm justice great mighty protect,joy,joy,fear,joy
Last product buy promise Absolutely terrible CustomerService,fear,fear,fear,fear
this Laughing while cry work too katherinemansfield failure laughter dealingwithfailure,joy,joy,fear,joy
kylemuir17 Ealvarezfight danawhite defend his belt against aldo after its not that hard grudge hold bitch,anger,anger,anger,anger
say should bore bore with but not bore rule cheerfully ignore,joy,fear,fear,joy
more aesthetically please than your fave,joy,joy,fear,joy
would like know about the source The President optimism about run the country wonder can answer curiosity,fear,fear,fear,joy
tfw you route your future come for openhouse futurecantor exhilarate NYCletsgo,joy,joy,joy,joy
save him after order him risk his life didn panic but stay calm and rescue him,fear,fear,fear,fear
great train course lot photos fun and laughter Photo will soon Boostercourse fun,joy,joy,joy,joy
sad song prefect night feel alone,sadness,sadness,sadness,sadness
speak this can the worst ever felt and even then its pass will still joyous occasion,joy,joy,sadness,joy
God will deliver the righteous their place salvation evil shall touch themØŒ nor shall they grieve,sadness,sadness,fear,sadness
God know why things happen sometimes just hard understand sad prayingforyou,sadness,sadness,sadness,sadness
cheer,joy,joy,joy,joy
ukulele bag have fall apart WELL LEAST life hasn yet Joys quote problemsolving behappy,joy,joy,joy,joy
RadioX wow not hear this forever Random but great sting xph,anger,anger,anger,anger
JoeShennan Meanwhile and get 40am train hope you really really enjoy that hotel Shennan fume,anger,anger,anger,anger
Watch this amaze live broadcast lively musically,joy,joy,joy,joy
droop saw naked wrestle and ask What get hole one jaymohrsports,sadness,sadness,sadness,sadness
turn over after kick way Texans Way Texans terrible noheart,fear,fear,fear,fear
wonder Corey will vote for Nicole snacole bb18 paulsgonnawin finale halfamill nervous,fear,fear,anger,fear
hipster behind the game find very hard pay attention while you talk about the politics grapes wrath SHUT,anger,anger,fear,anger
You offend,fear,anger,anger,anger
have pretty solid GPA kin major and now that look the average for dpt program feel even more discourage,sadness,sadness,sadness,sadness
just have that way think want absolute hope bear from absolute despair,fear,fear,fear,sadness
joyless soulless toy which look nearly identical They the perfect expression consumerism enjoy this franchise,fear,fear,joy,sadness
the whole thread jovial and fun and then this comment like FULL misogyny,joy,joy,fear,joy
the bright side with YouTube heroes leafy will finally get ban,joy,joy,joy,joy
anger inside turn fuel burn and watch myself spin down like inferno type,anger,anger,sadness,anger
have really strange and awful dream last night didn even eat cheese before bed lovemysleep,fear,fear,fear,fear
the same speech However mention foreign hand and fund terrorism the country ProudOfYouPrimeMinister,fear,fear,fear,fear
you feel horribly depress and despondent about life and your future always know just what say,sadness,sadness,sadness,sadness
watch Django Unchained Other people may frown but titter delight,joy,sadness,sadness,anger
there you After that wild start wouldn surprise all Sweden win this game Too much experience there panic,fear,fear,fear,fear
enjoy AHS tonight ahs horror americanhorrorstory,fear,fear,fear,fear
loismackey_ nah way that horrible,fear,fear,fear,fear
much hate for dude cheat women forego please their man they get lazy amp men get lazy amp then just pointless,sadness,fear,fear,joy
such homely pure piece gold Channel will attempt tart Mary Sue and Mel over out,anger,anger,fear,anger
literally gloomy for hour,sadness,sadness,sadness,sadness
tip from drink Uber passenger Today get park ticket blame karma but dumb ass forget pay the meter rage,sadness,fear,fear,anger
decorations all over Jersey already,fear,fear,fear,anger
happy have come across notebooks handmade would love talk you musthave want need happy amaze,joy,joy,joy,joy
hate winter dread arrival,fear,fear,fear,fear
